19fjq9x,"What Are Your Moves Tomorrow, January 26, 2024",OPINION_IS_UNPOPULAR,5977,1706216422.0,0.87,AutoModerator's Father
19evm3c,"Most Anticipated Earnings Releases for the week beginning January 29th, 2024",rylar,418,1706141197.0,0.97,🅱️arfield Enthusiast :Barfield:
19fbi9u,"$2,900> $173,000",ChoChoBear,1371,1706195450.0,0.91,
19ff6x8,PayPal shocking the world...,iBifteki,757,1706204942.0,0.96,
19figv0,PayPal shares fall after CEO announces AI-based products,Brendawg324,137,1706213242.0,0.98,1 day away from 140k
19fjjcf,Tesla Puts to Buy a Tesla!,TortoiseAcquisition,100,1706215933.0,0.95,
19fhftm,Tesla is the future 🚽🧻,pittluke,125,1706210630.0,0.85,
19fj028,Nancy Pelosi is the new Jim Cramer!,Gillodibilo,71,1706214584.0,0.94,
19f9ruu,"The U.S. economy grew at a 3.3% pace in the fourth quarter, much better than expected",whicky1978,575,1706190612.0,0.91,all about the pentiums BBBY
1ab730t,Bullish on NVDA after Intel Guidance,rayrayrex,32,1706235042.0,0.95,
1ab760y,10 bagger watching Boeing collapse,ryanthelion10,38,1706235282.0,0.94,
19fcj7y,"$3000 -> $60,000 🔥🔥",NVDAismygod,140,1706198214.0,0.94,:benny:
19fjslq,Immediately plummets 5% following the announcement,Brendawg324,40,1706216577.0,0.98,1 day away from 140k
19fj71j,I think Intel will hit $53-55,Meloonaa,273,1706215067.0,0.88,
19fb0q8,UNH $510 Puts. I’m throbbing,StockGambler27,144,1706194116.0,0.96,
1ab5ix0,NASDAQ:PYPL PayPal A Second Look.,PettyKnowNothing,14,1706230667.0,0.95,
19fk4wi,you're telling me there's a chance,elyuma,36,1706217425.0,0.97,
19ff9pn,PayPal innovating on how to drop 5+ billion in market cap in 1 min. $8k gain on put debit spread 65/64,Longwashere,40,1706205130.0,0.95,Dragon of Wallstreet
19fnomj,"The weed sector is for bag holders and morons, they said. Don't waste your time, they said.",tiddertikcus,61,1706226988.0,0.8,
1ab59rh,PayPal Had A Lightning Rod In Their Foot,Slut_Spoiler,9,1706230096.0,0.95,Has zero girlfriends
19fjbws,It's either a 1000% gain or I delete my account,ThrowAwayhfhdjhxnjd,57,1706215404.0,0.83,
19filww,"Before I found you guys I just had a bunch of SPY for years, but with your help I've diversified my portfolio.",AttackSock,27,1706213594.0,0.97,
19fb6xw,AMD 🔝,Angelsometimes,34,1706194606.0,0.91,
19fm1l3,Down the rabbit hole we go. What should I yolo my last on?,ViciousMoleRat,52,1706222592.0,0.87,
19epwd2,Sometimes its better to give up,spinachforeva,333,1706126937.0,0.95,
19fay6p,Here you go $TSLA,AgentO_,55,1706193920.0,0.97,
19fjw2l,👹,Ohmeluna,34,1706216815.0,0.95,
19fdagi,"Nice and girthy 9.7K profit on Tesla puts, there was no doubt 🔥",MrFinances,18,1706200209.0,0.92,
19fke77,"YOLO-ed 500 $47 puts on INTC, expiring tomorrow",maxiaoling,53,1706218147.0,0.89,
19el330,China is panicking.,New-Corgi-1685,1618,1706113743.0,0.93,
19fcpb8,Cost average $240 TSLA,vag_liccer11,139,1706198652.0,0.9,
19eu6qc,Former Microsoft CEO Steve Ballmer to receive $1 billion a year - doing nothing.,AtmosphereNo6743,297,1706137508.0,0.91,
19fjxxd,$INTC Earnings Thread,charade_philosopher,47,1706216941.0,0.9,
19fmdxr,Hello Earnings Season,Badmashkitty,22,1706223516.0,0.94,
1ab5rkg,Call me dumb but doesn’t this chart pattern show that $TSLA is about to shoot to the moon?,PANCAKEx74,146,1706231278.0,0.63,
19et7ph,Tesla profits crashed 23% in 2023 - its first decline since 2017,AtmosphereNo6743,510,1706135079.0,0.95,
19fjsf2,Thursday EOD update for Amazon pizza party play. PIZZA PARTY ODDS LOOKING GRIM. ONE LAST DAY TO HIT $160 FOR THE PIZZA PARTY 🍕🍕🍕,Longwashere,17,1706216563.0,0.91,Dragon of Wallstreet
1ab919q,1st 5xTSLA 1/2Account. Upset I didn't buy more & didn't hold to 2k a contract or sell & buy 180. Am I a true enough degenerate to be here?,Schuppe653898,5,1706240789.0,1.0,
19fic2m,Nice.,GeneralWhoopass,17,1706212905.0,0.87,
19f52o9,Nokia annouces 650m share buy backs and $NOK climbs 8%,urneighborshousemaid,36,1706172907.0,0.96,
19fawsc,$NYSE: JNJ Got Dope Like Pablo,PettyKnowNothing,8,1706193816.0,0.89,
19fkszp,"51k yolo on PCE tomorrow - Personal Consumption Expenditures? Nah, Puts Conquering Everything!",Gambled4MyRangeRover,17,1706219371.0,1.0,
19fd7zy,Spent the rest of my life savings betting on a TSLA drop. Didn't think it would happen so soon.,the_humeister,11,1706200032.0,0.92,anything is fine
19fgi3r,"Apple announces changes to iOS, Safari, and the App Store in the European Union",TheSoundOf_Muzak,17,1706208266.0,0.89,
19fepoi,TSLA 💎,FullPortPuts,11,1706203780.0,0.89,
19faopi,AMZN $500k 2DTE Pizza Guy ... where are you?,OldAd4526,16,1706193212.0,0.9,GOD'S PM
19flhwz,NVDA 425 PUTS are pupupprinting,Smallproduces,22,1706221191.0,0.77,
19fasbo,TSLA gainz,Diamond_Hands777,25,1706193484.0,0.92,
19ew2b2,US vs China,9mmNATO,191,1706142432.0,0.92,
1ab97ii,Does this fit here?,MikeSteelexx,3,1706241349.0,1.0,
19f6sw5,"Daily Discussion Thread for January 25, 2024",OPINION_IS_UNPOPULAR,11499,1706180441.0,0.9,AutoModerator's Father
19fc1yu,"$1,700 - $26,000 full port YOLOs",IDidIt4TehLulz,4,1706196915.0,0.94,
19fihfr,Wanted to post my gains scalping SPY 0DTEs before I lost my ban bet,kahlu_billy,8,1706213282.0,0.87,
1ab877c,Fed to allow emergency bank lending program to expire on March 11 (BTFP is toast March 11th),wasifaiboply,2,1706238285.0,0.86,
19flue4,"As Tesla revenue stagnates, its P/S multiple almost reached pre-COVID levels of 5x-6x.",ChampionshipUsed9855,18,1706222074.0,0.83,
1ab9bdn,"47,000$>>69,000$ / They Didn't Believe In Us Part 4/ Next Play ULTA",Dismal-Lunch-3697,4,1706241677.0,1.0,
19fd7f1,Pocket money from Elon,Impressive-Survey-54,6,1706199988.0,0.9,
19emsny,"Meanwhile, in the Chinese market...",takenorinvalid,114,1706119075.0,0.97,
19fk2mc,$V Earnings Thread,charade_philosopher,8,1706217263.0,0.94,
1ab8j7i,Intel loses,newprint,3,1706239256.0,0.83,
19f7ywv,United Steelworkers union files grievances against U.S. Steel over proposed Nippon sale,printeroutofinkagain,28,1706184854.0,0.89,
19fhw0f,NVDA,ffthrowawayforreal,12,1706211780.0,0.85,
19fejua,"US 4Q GDP grew 3.3%; above all estimates, following the 4.9% Q3 clip",betsharks0,2,1706203387.0,0.83,
1ab97tr,Tesla CEO Musk: Chinese EV firms will 'demolish' rivals without trade barriers,gg562ggud485,3,1706241377.0,1.0,
19fdt76,Random stockpicker decides my faith,Separate-Tea-723,22,1706201558.0,0.85,
19flph4,TQQQ long term,god_among_men,10,1706221724.0,0.72,
19fcmhf,What kind of announcement from PayPal would justify me dumping money into it this morning,wht1995,63,1706198455.0,0.81,
19en443,No pain no gain baby,,43,1706120322.0,0.99,
19fi6u8,What should I do now?,coastalvida,7,1706212551.0,0.87,
19fawbn,Bought TESLA puts yesterday before ER,SnooGoats8271,21,1706193781.0,0.84,
19fayr0,"lol, makes nice Coinbase gains, loses them a few weeks later on Tesla. Also makes outlandish predictions. What's her WSB username?",Mister_Lonely_,13,1706193959.0,0.88,xoxoxoxoxo
19esf27,$TSLA earnings be trash,TheFakeParth20,45,1706133128.0,0.96,
19ep02i,"Why I'm getting Tesla Puts, A Deep Dive into Earnings (A Must Read)",TheNextPlay,397,1706124774.0,0.89,
19fd0vc,AMZN May 17’24 $200 Call,NootropicHar,5,1706199501.0,0.86,
19ew5jz,The party is over,InternationalTop2410,129,1706142685.0,0.9,
19fgdlx,Name change -> PayPal to pAIpal,shantired,4,1706207944.0,0.83,
19ettvt,"Tesla misses fourth-quarter estimates on weak auto revenue, warns of lower volume growth in 2024",_mattske,116,1706136624.0,0.95,
19elr9j,Put the little savings I had into this first thing Monday and was afraid if losing it all. Isn't it supposed to always be red?,Remote_Impression605,333,1706115433.0,0.96,
19ekkym,"I found the Cheat code to getting rich, easiest options market ever",GoldenRetriverOrDie,445,1706112451.0,0.89,
19fgwn6,Grocery Outlet Bargain Market is a BARGAIN,clamchoderrr,30,1706209294.0,0.73,
19fd79g,Best single trade yet (CRWD leap) and Goog calls. But wait theres more! Weed's being rescheduled bois (in with ~50k) $MSOX,Bonzoso,3,1706199976.0,0.83,
19fcljx,"Ladies and gentlemen, the end of an era 😢",DrunkOnIntuitions,6,1706198393.0,0.74,
19f0rdw,I'd call that a victory,yollobrolo,20,1706156439.0,0.93,
19fjyrx,€125k capital gain in 1 week,Safe_Asparagus_539,10,1706217001.0,0.65,
19ec4mf,TESLA CALLS?!?!,WordyHurricane,539,1706083608.0,0.93,
19fe9j0,T-Mobile key insider sold shares worth $478 mln in January. Largest monthly sales volume ever 😀,ChampionshipUsed9855,6,1706202667.0,0.83,
19es7bm,Cramer is positive in Tesla $TSLA,GeeksGuideNet,160,1706132588.0,0.91,
19ev0kd,Best. Day. Ever.,jroth55,39,1706139637.0,0.94,
19fiwii,What has happened to $Snap is interesting.,TechHedz,8,1706214330.0,0.69,
19f3gnb,$RIVN is definitely a short term large gain BUY right now,ObiWahnKenobi,154,1706166017.0,0.7,
19f97z6,Turkey’s central bank hikes key interest rate again to 45% to battle inflation,WadsoMarkets,1,1706188972.0,0.82,
19fbxhw,"Thank you, $TSLA!",TheBlackSpeed,6,1706196591.0,0.74,
19fap7l,There’s always a smart-sounding reason to sell,WadsoMarkets,11,1706193252.0,0.82,
19fgf5u,I thought I would inverse wsb...,4everinvesting,8,1706208055.0,0.68,
1ab9lf5,Why are they ABOVE THE LAW!!???,Any-Sound-391,2,1706242560.0,0.67,
19ejwzq,How else am I supposed to feel alive?,witness_this_,22,1706110739.0,0.99,
19fiy2u,MSFT Earnings call,Equivalent_Bell_2953,10,1706214445.0,0.57,
1ab995d,I thought we closed not so okay? 😀,Andy_Sing,2,1706241497.0,0.67,
19fag63,Nokia beats profit expectations and forecasts demand recovery,wallstreetbets007,6,1706192549.0,0.83,
19fiosg,What does this do for the stock?,PartyMessage6820,8,1706213790.0,0.7,
19exij5,Msft earnings yolo,rsaari13,37,1706146533.0,0.95,
19fb4k8,Starting the year off right $TSLA and $ZIM,theDOMSisReal,6,1706194420.0,0.74,
19ffowb,Knew I was in trouble when I saw everyone buying Tesla puts yesterday…..,Outrageous_Strike780,4,1706206171.0,0.6,
19erjfw,$TSLA Earnings Thread,charade_philosopher,360,1706130954.0,0.87,
19f9xx7,TSLA: testing 192 support and lower support near 176,Andy_Sing,58,1706191112.0,0.72,
19fiwod,INTC and VISA Earnings,rrmedikonda,8,1706214341.0,0.67,
19fivpg,"Here’s my 3 leg options parlay, smaller positions since my DD was lackluster for these pics. Tail at your own risk (not financial advice)",MrFinances,13,1706214274.0,0.63,
19f9rn5,SUMMARY OF US Q4 GDP REPORT,LadsoStocks,7,1706190596.0,0.76,
19fb3nm,“Bringing YOLOs back”,itsmrlowetoyou,9,1706194351.0,0.72,My trauma? Pineapple on pizza
19er5g8,"What Are Your Moves Tomorrow, January 25, 2024",OPINION_IS_UNPOPULAR,9693,1706130013.0,0.91,AutoModerator's Father
19fi2xa,TSLA Earnings Report Q3,Meloonaa,1,1706212275.0,0.77,
19fi2bg,YOLO Update,mastagoose,11,1706212234.0,0.7,
19f7i53,I'm the $2k to $50k Options Account Challenge Guy and I Have Some Gains to Share From My Larger Account,Advanced-Plays,21,1706183159.0,0.6,
19erioa,Meta passes $1 trillion in market cap,ValueInvest0r,77,1706130904.0,0.83,
19eoucp,Ready for Earnings,firenamedgabe,90,1706124383.0,0.94,
19enj0k,"Chipotle Is Going to Hire 19,000 New Employees for Busy ""Burrito Season""",rightlibcapitalist,100,1706121262.0,0.9,
19en1xr,One of us?,Stanssky,29,1706120179.0,0.96,
19eiw2e,These ads are getting a little too personal,Riskfreeee,35,1706108029.0,0.97,
19fhsmt,Just a lil $V YOLO for a good night's sleep.,Gemini_Of_Wallstreet,3,1706211539.0,0.66,
19erxax,What all Tesla bulls need to visit,Supreme-Vlouted,5,1706131905.0,0.87,
19fc0y1,When to buy options for earnings plays?,fen-q,10,1706196840.0,0.63,
19e4jee,Delta Boeing plane loses nose tire moments before takeoff: 'Rolled off the runway',AdamantiumBalls,403,1706058404.0,0.94,
19far4v,AMD- testing weekly regression with strong greens recently.,Andy_Sing,2,1706193395.0,0.66,
19ekevj,"In 1994-1995, tech stocks rallied into the first rate cut, then puked.",mrmrmrj,166,1706112020.0,0.79,
19es9ed,Netflix Earnings Report YOLO,Meloonaa,14,1706132731.0,0.85,
19essvj,Billionaire Joe Lewis—former owner of Tottenham Hotspur—pleads guilty to insider trading,AtmosphereNo6743,12,1706134049.0,0.94,
19essls,Netflix gains,Fkthisst93,15,1706134031.0,0.89,
19eru0d,TESLA EARNINGS,Lost_Albatross_8416,64,1706131691.0,0.85,
19fj7sx,"First time, am I doing it right? TSLA 185 1/26 call. Roast me",JackFener,6,1706215120.0,0.57,
19e84g8,Cramer says bitcoin will go down,GeeksGuideNet,446,1706068966.0,0.95,
19euvfw,Why stress about market movement everyday? Just go long guts with SPY options,Spiffy_Cunt_Wagon,32,1706139272.0,0.86,
19fhxug,TSLA puts,Lost_Albatross_8416,3,1706211918.0,0.5,
19er2mw,Just buy SEMI/AI and ride the hype. The roller coaster will end soon but for now it’s green day’s ahead.,itsmrlowetoyou,38,1706129827.0,0.88,My trauma? Pineapple on pizza
19fbd89,MSTR - it’s a buy in this range. SL near lower 400s,Andy_Sing,5,1706195070.0,0.58,
19erynl,highly regarded bullish Tsla earning yolo,foamboardsbeerme,65,1706131999.0,0.82,
19erbnt,Praying for Elon Pummp,AgentO_,149,1706130422.0,0.66,
19ffxdv,"GDP QoQ grows 3,3% (above forecast). Is this situation bullish or bearish?",CardiologistNeat598,24,1706206774.0,0.42,
19erk5o,Average WSB user hasn't seen this message from Fidelity,MarkWeberca,13,1706131002.0,0.88,
19es03r,"RH vs WB, which app is regard friendly?",m0nst3r24,21,1706132099.0,0.83,
19eukx6,"FAA Halts Boeing 737 Max Production Expansion, Buttigieg Says ""Bigger Picture Exam"" Imminent",wallstchicken,16,1706138523.0,0.82,
19e09z0,Alaska Airlines CEO says company found loose bolts on ‘many’ Boeing Max 9s,crappypoopoo69,231,1706047126.0,0.98,
19er0yb,Opened a little gambling account last week. Am I doing this right???,GoGalt,22,1706129709.0,0.76,
19ekowz,"Nvidia, Microsoft, Google, and others partner with US government on AI research program",toydan,30,1706112739.0,0.9,Puts on $JIM
19epq6l,Student loans for next semester,MathematicianWhole29,30,1706126522.0,0.78,
19e01eo,480k yolo on Amazon . ILL BUY A PIZZA PARTY FOR AMAZON EMPLOYEES IF ITS HITS $160 BEFORE END OF WEEK. YOU MUST PLEASE THE SHARE HOLDERS.,Longwashere,617,1706046531.0,0.95,Dragon of Wallstreet
19ep9ma,US corporate bond markets are “on fire” as companies have sold a record $150bn of debt,absoluteunitvolcker2,9,1706125411.0,0.93,
19fcmyu,Do capital losses work like this?,Bruthar,10,1706198485.0,0.44,
19eipdp,How to turn 5k into 20k overnight,DinkTongue,32,1706107523.0,0.92,
19ebfyq,BABA 1000% gain 1800 to 18K,New-Set-3059,35,1706080742.0,0.95,
19eqxd9,"Microsoft hits $3 trillion value, cementing strength of AI rally",red_fluke,17,1706129471.0,0.82,
19etw0x,Do you regret not pelosing NVIDIA?,Front_Expression_892,76,1706136774.0,0.61,
19eu4eo,MSOS and Cannabis,starsmisplaced,7,1706137341.0,0.74,
19f9zxr,Will Peloton (PTON) finally report profitability in earnings on Thurs? It's looking likely.,_BreakingGood_,11,1706191268.0,0.43,
19emjic,Nvidia finally cleaning up my all time on this account,putsonjesus,20,1706117359.0,0.86,callsonsatan
19dulq8,"$13,000 YOLO on Tesla Earnings. Will be worth $50,000 or $0🔥",NVDAismygod,918,1706033116.0,0.92,:benny:
19eejca,"Daily Discussion Thread for January 24, 2024",OPINION_IS_UNPOPULAR,11194,1706094048.0,0.86,AutoModerator's Father
19ekt21,QQQ gains,fakeyfaked13,9,1706113039.0,0.86,
19e0f3k,Netflix password crackdown pays off as subscriber surge sees stock hit two-year-high,AtmosphereNo6743,310,1706047467.0,0.9,
19emd5k,Am I doing options right?,IamSarc,15,1706116934.0,0.85,
19erbge,Anyone buy 0DE Spy Puts to hedge their weekly NVDA calls?,rayrayrex,9,1706130406.0,0.74,
19ej22k,"Bank of Canada Holds Key Rate at 5%, Signals It's Done With Hikes",s1n0d3utscht3k,2,1706108487.0,0.88,
19f9o5p,Netflix vs Tesla,drew1027,22,1706190316.0,0.46,
19ers73,"One hour left, see what happens",Proper-Watercress951,2,1706131566.0,0.75,
19e4ekj,"Alibaba co-founders buy more than $200 million worth of shares, sending stock up",Accomplished-Bill-45,71,1706058033.0,0.94,
19egdpy,$PLUG go brrrr,StevenTheScot,13,1706100698.0,0.81,
19eorp6,"French farmers block roads, bridges as protests sweep country",Plus_Seesaw2023,4,1706124207.0,0.74,
19e3pod,Robinhood agrees to pay $7.5 million to settle complaints over its sales practices,One_Mall4203,70,1706056063.0,0.96,
19eo64s,"COSTCO Stock Analysis: 571$ Fair Value - DCF, Graham, Fear & Greed, DuPont",SmellyFatCock,21,1706122770.0,0.72,
19fbw1s,$BABA calls?,Narrbags72,7,1706196480.0,0.31,you know who else had flair?
19ej6sy,Google and AT&T invest in Starlink rival (AST SpaceMobile) for satellite-to-smartphone service,dimaghnakhardt001,25,1706108820.0,0.87,
19enimj,SEC Voting Today on Strict New Rules for SPAC Companies,rightlibcapitalist,7,1706121237.0,0.79,
19elxko,"$12k AMD gain 🔥 by Taking over ""Update 2: It's either several million or..."" from u/ThrowAwayhfhdjhxnjd",normal-re-editor,14,1706115862.0,0.82,
19elzlh,"Analysts downgrading Apple will turn around after next earnings call, says Morgan Stanley",TheSoundOf_Muzak,2,1706116003.0,0.75,
19doah7,Are you buying China or nah?,redditor3000,783,1706016099.0,0.9,
19e8ooa,Alright boys. Will it keep going up?,sug_madek,109,1706070788.0,0.89,
19ekg9r,"Hope y'all are still buying AKAM calls no matter the expiry, next prediction...",jessie-farsi,5,1706112109.0,0.7,
19e2mj7,Netflix’s stock surges following huge subscriber growth and increased revenue that tops expectations,Brendawg324,66,1706053110.0,0.82,1 day away from 140k
19e95k3,Alaska Airlines To Inaugurate Its Boeing 737 MAX 8 Tomorrow From Seattle To Los Angeles,Weak_Commercial_7124,25,1706072347.0,0.9,
19dqdsd,Guess they had no Intel about it.,Madness_69,168,1706022195.0,0.95,
19dxzum,"So, this is kinda why I think Netflix will beat",TheNextPlay,168,1706041479.0,0.86,
19ei7hr,Some SPY gains,vshaddix,1,1706106137.0,0.8,
19eovej,ULCC - Frontier over Spirit?,Qman1211,2,1706124454.0,0.62,
19e7awu,TSLA PUT Play,Meloonaa,120,1706066401.0,0.83,
19f5udh,Possible offer for Paramount PARA,BehaviorFin,5,1706176388.0,0.44,
19dkpvc,I am financially ruined (Italian gelato futures,GangbankerJesus,268,1706002648.0,0.9,
19e02vk,Apple is pushing the launch date of its secret EV car project 'Titan' back again to 2028,AtmosphereNo6743,43,1706046628.0,0.91,
19dfs0v,Why face the truth when you can ignore it 👌🏻,,89,1705983382.0,0.98,
19e3say,Puts anyone,Future-Broker,18,1706056263.0,0.96,
19dyuir,"What Are Your Moves Tomorrow, January 24, 2024",OPINION_IS_UNPOPULAR,7030,1706043614.0,0.92,AutoModerator's Father
19e0x01,60k spy yolo,Low-King3567,65,1706048690.0,0.94,
19e8sup,Tsla Calls,trymesucka,22,1706071173.0,0.86,
19dvnwg,CNBC has you covered.,unwanted_hair,22,1706035705.0,0.96,
19esg0l,ASML mon amour,Lucky_Information645,3,1706133194.0,0.53,
19dr5yn,Very modest $5.8K gain on Spirit Airlines Comeback,MrFinances,40,1706024317.0,0.96,
19emsj3,Legit advanced charting,daimon_tok,3,1706119033.0,0.67,
19dlkud,Good ol' Jimmy,AdCool1233,44,1706006277.0,0.91,
19ebmw5,Nice timing for anonymous TSLA leak - reuters,retroillumination,14,1706081526.0,0.72,
19dyku1,Update: All My Dinero. Dinner or no dinner,ThrowAwayhfhdjhxnjd,28,1706042930.0,0.86,
19e35bc,RUM and TKO ftw,Awkward_Jack,21,1706054492.0,0.89,
19dqwju,ONE OF US! ONE OF US!,ChillThrillsExtract,38,1706023636.0,0.96,
19e8ipr,"1,000,000% IV?!",FlieOrDie,15,1706070242.0,0.69,
19d2mlu,Pray for me,FullPortPuts,634,1705948337.0,0.93,
19dt6z2,12k Netflix YOLO (not a recommendation play like my previous TRV play),Gambled4MyRangeRover,70,1706029444.0,0.89,
19edonk,"Sherwin-Williams, earnings tomorrow, old boomer company that should be pumping? Why isn't it pumping?",_BreakingGood_,25,1706090492.0,0.58,
19dnm15,NETFLIX TO STREAM WWE RAW - LET THE BER SMACKDOWN BEGIN,Mister_Lonely_,80,1706013914.0,0.84,xoxoxoxoxo
19ddtcm,Could this be the bottom?,Synfinium,377,1705977300.0,0.89,
19elusn,$TSLA earnings $170 entry?,Happy_McDerp,18,1706115679.0,0.48,
19dz3d9,$NFLX Earnings Thread,charade_philosopher,50,1706044209.0,0.83,
19e0mwy,NVDA bears - TY ❤️ for your sacrifice. $11.5K in gains (+44%). Apologies in advance for upsetting people that don’t know how to take profit.,NaNaNaNaNaNaNaNaNa65,16,1706048001.0,0.76,NVDA bulls fucked your mom
19dt1k9,PayPal’s January 25th event. Sell the News?,Tribebro,107,1706029085.0,0.85,379C - 59S - 7 years - 0/0
19dbjnx,It’s only just beginning,Laterxgater,252,1705970698.0,0.94,
19dx2b6,Investing Platform Public Launches Options Trading—And Pays Customers for Their Orders,experimentjon,16,1706039139.0,0.86,
19dqnpo,PSA: SWK does NOT sell the fancy cups,TwilightSpartan,22,1706022961.0,0.84,
19dduk3,Nightmare for the investor- Down 16% YTD,hbull2021,238,1705977400.0,0.93,
19dieuh,Bloomberg: Credit Card Delinquency Rates Climb to Decade High in Fed Study,fishupontheheavens,66,1705992780.0,0.96,
19dou5t,DWAC warrants,Breadman42000,45,1706017797.0,0.82,
19dzqce,Ottawa estimates 25% of small businesses missed CEBA deadline,dawsonssd,22,1706045772.0,0.81,
19cy0tv,What to tell my GF? Lost 4K in 15 min,WaystenJulian,1909,1705936942.0,0.87,
19dpvlk,Plug Power Starts Production of Liquid Green Hydrogen at its Georgia Plant,tendieful,62,1706020797.0,0.83,
19dlwr3,"Daily Discussion Thread for January 23, 2024",OPINION_IS_UNPOPULAR,8323,1706007642.0,0.78,AutoModerator's Father
19drl59,SPY 485C YOLO,WAPer69,36,1706025419.0,0.85,
19dc60u,Update 2: It's either several million or ....,ThrowAwayhfhdjhxnjd,68,1705972448.0,0.93,
19dd60v,AMD: All My Dinero. It's either Dinner or no Dinner,ThrowAwayhfhdjhxnjd,105,1705975361.0,0.93,
19d5lzd,We are so back.,kpres12,78,1705955753.0,0.98,
19e3r3j,"Now that bitcoin ETFs exist, any reasons to still hold Microstrategy (MSTR) in my Roth IRA?",trisurfer126,22,1706056174.0,0.58,
19dpuoz,"SOFI earnings 29th January , DD from an Italian married to a Kiwi (New Zealand person , a woman in my case , not the fruit)",Sakuraalwaysright,58,1706020723.0,0.71,
19eim7v,Warren Buffett's New Secret Stock PYPL?,grimkhor,34,1706107280.0,0.46,Lambos before sleep
19dnra6,Boeing QA Issues Article,kailfarr,13,1706014402.0,0.87,
19ekc4y,It was fun short ride,ducvinh169,2,1706111823.0,0.36,
19dxvzr,DCF Ford (F) 68 % up,vioviolatlat,12,1706041210.0,0.63,
19dqm9w,Uvix put yolo,Brassmonkay3,11,1706022851.0,0.86,
19ekrff,How can we bet against a retail trader?,MrSam1998,24,1706112924.0,0.38,
19d18db,$100k gain in a day $DWAC,kk7766,315,1705944982.0,0.86,Loves bottoms
19d9pg4,New material found by AI could reduce lithium use in batteries,Slut_Spoiler,70,1705965795.0,0.89,Has zero girlfriends
19d1uhk,Is this what everyone keeps talking about?,Fox_Technicals,48,1705946459.0,0.97,
19de2sj,Best mining stocks of 2024? Also is China purposefully collapsing the global price of lithium?,Radiant-Lock-1141,82,1705978084.0,0.85,
19e8b9s,NFLX beat has made me bearish on theatre stocks and SBUX looks like it wants to die.,Magnasparta1,24,1706069583.0,0.52,
19ejgw0,Netflix Subscribers,Honestyonly22,61,1706109573.0,0.44,
19df7ig,How wrecked am I getting tomorrow…,Long_duk_dong_duck,56,1705981555.0,0.91,
19czav5,10K SPY PUT YOLO | 480 P 1/31/2024 Expiration | 54 Contracts @ 1.98 Each,SuperBearPut,274,1705940248.0,0.96,
19cwn23,Mag 7 is still not 100% of the index so there is still upside.,mrmrmrj,74,1705933088.0,0.97,
19e5hu4,"30,000$>>>>47,000$ They Didn't Believe In Us Part 3/ Get F*cked",Dismal-Lunch-3697,17,1706061168.0,0.51,
19doj7s,Evercore ISI sees a further 10% downside in Tesla stock By Investing.com,Insider_Research,8,1706016869.0,0.76,
19ehjxn,A message to you noobs,5k4_5k4,15,1706104299.0,0.34,Best macro economic trend ANALyzer
19dd982,I made 23k during the 🌽 hype,Inner-Trip-456,9,1705975630.0,0.83,My anoos is ready
19d67mc,"What Are Your Moves Tomorrow, January 23, 2024",OPINION_IS_UNPOPULAR,5930,1705957241.0,0.89,AutoModerator's Father
19dptku,JinkoSolar Wins the Solar Power World 2023 Leadership in Solar Energy Award,TheGLitCashDude,2,1706020630.0,0.65,
19d3dtp,SPY 0DTEs have treated me well the past few days 📈 despite some 📄 ✋ sells...,shash678,56,1705950194.0,0.91,
19dllqc,$M buyout offer rejected,Traditional_Bobcat_4,8,1706006384.0,0.87,
19edyhl,Game Changer: Xiaomi Will Release and Sell the Fastest EV in the World,Independent_Builder3,28,1706091707.0,0.41,
19daxu5,Archer-Daniels-Midland $ADM dumped 24% today on news of SEC accounting probe,lmao_just_lmao,57,1705969027.0,0.92,
19cl1mh,The $3500 Apple Vision Pro has arrived - but you can't use Netflix or YouTube on it,AtmosphereNo6743,782,1705890951.0,0.87,
19dlhcr,"The worst CEOs. I'll start: Steven Rendle, VFC",valvasss,56,1706005876.0,0.63,
19ctdqp,We're all highly regarded individuals,Solid-Definition-997,39,1705922280.0,0.98,
19ehjey,TESLA will crumble! sell while you still can.,Lost_Albatross_8416,110,1706104256.0,0.44,
19cukl0,It is unlikely - but not unprecedented - for the market to rally for years from the current high valuation,mrmrmrj,113,1705926604.0,0.83,
19d2vvd,NIO - All time low - Time to jump in balls deep ?,FlyingEagle73,170,1705948946.0,0.75,
19dgput,Conspiracy Theory investing strategy..,Cjoseph1971,48,1705986570.0,0.67,
19d7k5t,Blackrock just added up to their $LUMN position,tom_zemeckis,20,1705960455.0,0.82,
19csdhm,Cheap Russian Oil Reduces OPEC’s Share in India’s Imports to Record-Low 50%.,Sammylive,57,1705918080.0,0.96,
19dfgpu,$PYPL Ad: Six innovations that will revolutionize commerce,InvestInLaughs,26,1705982380.0,0.8,
19drfi1,Upstart (UPST) is up for a good start?,tenkaishy,18,1706025007.0,0.57,
19cxqdk,Am I WSB approved?,RAV-Rider,47,1705936156.0,0.95,
19cabbs,The reality of this market in 2 pictures,Silverpatriot7,308,1705862492.0,0.88,The Wolf of 🌈 Street
19d3jmm,$NFLX 487.5 Calls anyone? That IV says otherwise 😷,Dyblord,43,1705950606.0,0.8,
19dshb7,Netweb - Q3FYE23 results,mendelseed,2,1706027675.0,0.5,
19ciyl7,Loss porn. Down 30k from an investment of 50k.,Dumbengineerr,515,1705884738.0,0.94,
19chvmg,"Yes, I'll have one Wendy's please",Particles1101,60,1705881655.0,0.99,
19dbaek,Blow Up Risk of a Money Market Fund,AttorneyJackKelly,54,1705969974.0,0.66,
