19d5h7r,Google & AT&T Invest in AST,Puzzled_Bath_984,16,1705955432.0,0.84,
19dl2ti,France's Sanofi to buy U.S. drugs project INBRX-101 for about $2.2 billion,Fit_Age9637,3,1706004178.0,0.63,
19dce6l,NASA and Archer ($ACHR) partner on next-gen battery tech for electric aircraft,ladalyn,7,1705973105.0,0.67,
19cxu1n,"UK Inflation Sees First Uptick in Nearly a Year, Sparking Debate on Monetary Policy.",Sammylive,17,1705936433.0,0.94,
19ct4h0,"Daily Discussion Thread for January 22, 2024",OPINION_IS_UNPOPULAR,8920,1705921275.0,0.83,AutoModerator's Father
19dfyf9,Where are you putting your money with the upcoming SC ruling looming?,dcrico20,81,1705983981.0,0.53,
19c8yn9,betsstreetwall\s,nyc2bad,92,1705859138.0,0.96,
19cjjib,Amazon slips to fourth as Apple smashes World's Most Powerful Brands Lists for 2024,AtmosphereNo6743,32,1705886389.0,0.9,
19deu2o,How can we monetize war contracts as tensions rise?,ripwes,25,1705980402.0,0.54,
19ch79n,$ZIM - The US wants to end the Houthis soon,punanilover_69420,197,1705879791.0,0.86,To infinity or zero
19cxclj,PTON. I see a perfect head and shoulders here. Do you guys notice the same? I jumped last week... not sure if I should keep adding,TraderByNature,92,1705935127.0,0.56,
19dg3y1,$CELH. Is their appointment of Suntory instead of PepsiCo for UK market a concern?,moneyorangeapple,3,1705984498.0,0.5,
19ckjlh,The trades I take (bottom) vs the trades I don't.,Synfinium,29,1705889382.0,0.89,
19ck529,"20,000$>>>>30,000$ They Didn't Believe In Us Part 2",Dismal-Lunch-3697,36,1705888155.0,0.8,
19c4w26,"Update: NVDA yolo - I’m gunna keep holding. Probably sell some covered calls. For the NVDA bears, the color you are seeing is called “green”",NaNaNaNaNaNaNaNaNa65,173,1705848328.0,0.92,NVDA bulls fucked your mom
19cdnbw,"What Are Your Moves Tomorrow, January 22, 2024",OPINION_IS_UNPOPULAR,5926,1705870845.0,0.93,AutoModerator's Father
19bp214,All in on reddit calls,DannyClash007,1613,1705793156.0,0.88,
19dtjms,I am financially ruined (Canadian Maple Syrup futures),internetf1fan,54,1706030549.0,0.39,
19cb31p,That's the Spirit - SAVE and JBLU appealing ruling | Trading on News,sneakymooseattack,101,1705864411.0,0.92,
19bt9ji,TSLA Holders in 2024,hbull2021,364,1705805481.0,0.97,
19c376l,"Poor Man’s Covered Call What it is, why I’m doing it with $30k worth of MSFT calls , and why you should consider trying it. TLDR at TOP",Lensky0101,231,1705842979.0,0.87,
19bij7e,Did I just make half a million by mistake?,Reddddeye,640,1705775992.0,0.92,
19bvaqw,Vision Pro’s coming. What are your AAPL moves??,Opening_Past_4698,376,1705812359.0,0.9,
